id	conversation_id	created_at	date	time	timezone	user_id	username	name	place	tweet	language	mentions	urls	photos	replies_count	retweets_count	likes_count	hashtags	cashtags	link	retweet	quote_url	video	thumbnail	near	geo	source	user_rt_id	user_rt	retweet_id	reply_to	retweet_date	translate	trans_src	trans_dest
1403274880188100612	1403274880188100612	2021-06-11 16:56:17 CST	2021-06-11	16:56:17	+0800	183749519	paulg	Paul Graham		"""Without plate tectonics, our planet wouldn’t have a climate stable enough to support life over the billions of years it’s been evolving.""   https://t.co/73iMJRoqjZ"	en	[]	['https://nautil.us/issue/86/energy/why-aliens-and-volcanoes-go-together-rp']	[]	4	16	78	[]	[]	https://twitter.com/paulg/status/1403274880188100612	False		0								[]				
1403012672577323009	1300313788495790086	2021-06-10 23:34:22 CST	2021-06-10	23:34:22	+0800	183749519	paulg	Paul Graham		@david_perell I don't think I said that.	en	[]	[]	[]	12	1	77	[]	[]	https://twitter.com/paulg/status/1403012672577323009	False		0								[{'screen_name': 'david_perell', 'name': 'David Perell', 'id': '240049622'}]				
1402922716987105280	1402920976933818368	2021-06-10 17:36:55 CST	2021-06-10	17:36:55	+0800	183749519	paulg	Paul Graham		"@SteveStuWill Seems like it was actually ""Good ideology. Wrong species."" And he was talking about Marxism specifically.   https://t.co/IabyvJd3ie"	en	[]	['https://quoteinvestigator.com/2017/04/14/species/']	[]	2	4	68	[]	[]	https://twitter.com/paulg/status/1402922716987105280	False		0								[{'screen_name': 'SteveStuWill', 'name': 'Steve Stewart-Williams', 'id': '33856936'}]				
1402861862505549828	1402861862505549828	2021-06-10 13:35:06 CST	2021-06-10	13:35:06	+0800	183749519	paulg	Paul Graham		"If you told people a couple decades ago that we'd be talking about ""the movement to end advanced math classes,"" they wouldn't have believed it."	en	[]	[]	[]	117	265	2342	[]	[]	https://twitter.com/paulg/status/1402861862505549828	False	https://twitter.com/Noahpinion/status/1402669181007384584	0								[]				
1402513097164742656	1402513097164742656	2021-06-09 14:29:14 CST	2021-06-09	14:29:14	+0800	183749519	paulg	Paul Graham		"""Now the script has flipped and a new solar plant is almost three times cheaper than a new coal one. The price of electricity from solar declined by 89% between 2009 and 2019.""   https://t.co/TjuEAywtsq"	en	[]	['https://ourworldindata.org/battery-price-decline']	[]	44	301	1554	[]	[]	https://twitter.com/paulg/status/1402513097164742656	False		0								[]				
1402363646869655553	1402363646869655553	2021-06-09 04:35:22 CST	2021-06-09	04:35:22	+0800	183749519	paulg	Paul Graham		Is this now the oldest living thing?	en	[]	[]	[]	31	15	226	[]	[]	https://twitter.com/paulg/status/1402363646869655553	False	https://twitter.com/Jamie_Woodward_/status/1402014949841453057	0								[]				
1402345044133220355	1402342546114859010	2021-06-09 03:21:27 CST	2021-06-09	03:21:27	+0800	183749519	paulg	Paul Graham		@compusophy calm air	fr	[]	[]	[]	9	0	73	[]	[]	https://twitter.com/paulg/status/1402345044133220355	False		0								[{'screen_name': 'compusophy', 'name': 'compusophy', 'id': '1254442397288677376'}]				
1402337527944654851	1402337527944654851	2021-06-09 02:51:35 CST	2021-06-09	02:51:35	+0800	183749519	paulg	Paul Graham		When someone who (a) is not ideological, and (b) has a very deep understanding of the data, says something that makes a lot of people angry, it's likely to be both (c) true, and (d) important.	en	[]	[]	[]	23	89	702	[]	[]	https://twitter.com/paulg/status/1402337527944654851	False	https://twitter.com/MaxCRoser/status/1402244080139223044	0								[]				
1402220275681402880	1402212618786463744	2021-06-08 19:05:40 CST	2021-06-08	19:05:40	+0800	183749519	paulg	Paul Graham		@darirry Yes, both Viaweb and YC felt like projects of my own. The biggest difference was that I had collaborators. Another big difference was that they made money.	en	[]	[]	[]	0	0	6	[]	[]	https://twitter.com/paulg/status/1402220275681402880	False		0								[{'screen_name': 'darirry', 'name': 'Darry', 'id': '1381821277317394432'}]				
1402214795764506626	1402213986175578113	2021-06-08 18:43:53 CST	2021-06-08	18:43:53	+0800	183749519	paulg	Paul Graham		@TheIndianDM Seek out friends to collaborate with. You'll keep one another's spirits up.	en	[]	[]	[]	8	14	371	[]	[]	https://twitter.com/paulg/status/1402214795764506626	False		0								[{'screen_name': 'TheIndianDM', 'name': 'Arvindh Sundar', 'id': '1199581342364647425'}]				
1402212618786463744	1402212618786463744	2021-06-08 18:35:14 CST	2021-06-08	18:35:14	+0800	183749519	paulg	Paul Graham		A Project of One's Own:  https://t.co/lImAG4RyUQ	en	[]	['http://paulgraham.com/own.html']	[]	68	191	1134	[]	[]	https://twitter.com/paulg/status/1402212618786463744	False		0								[]				
1402178890882326533	1402173449284501504	2021-06-08 16:21:13 CST	2021-06-08	16:21:13	+0800	183749519	paulg	Paul Graham		@nw3 I'm actually curious about this case. That phenomenon would have decreased the expression of support for exploring the lab leak hypothesis, but it should not have caused nearly 100% of experts to remain silent, as happened.	en	[]	[]	[]	9	1	28	[]	[]	https://twitter.com/paulg/status/1402178890882326533	False		0								[{'screen_name': 'nw3', 'name': 'Nick Walker', 'id': '17115455'}]				
1402173449284501504	1402173449284501504	2021-06-08 15:59:36 CST	2021-06-08	15:59:36	+0800	183749519	paulg	Paul Graham		"""The study was prepared in May 2020 by the Lawrence Livermore National Laboratory.""   https://t.co/0pGAaaKlvD"	en	[]	['https://www.wsj.com/articles/u-s-report-concluded-covid-19-may-have-leaked-from-wuhan-lab-11623106982']	[]	34	69	414	[]	[]	https://twitter.com/paulg/status/1402173449284501504	False		0								[]				
1401959919381778437	1401909039936819204	2021-06-08 01:51:06 CST	2021-06-08	01:51:06	+0800	183749519	paulg	Paul Graham		@DrLeanaWen I think you mean more than half, not less than half.	en	[]	[]	[]	5	0	26	[]	[]	https://twitter.com/paulg/status/1401959919381778437	False		0								[{'screen_name': 'DrLeanaWen', 'name': 'Leana Wen, M.D.', 'id': '605153786'}]				
1401958051154903044	1401958051154903044	2021-06-08 01:43:41 CST	2021-06-08	01:43:41	+0800	183749519	paulg	Paul Graham		9 yo was surprised to learn it's Asperger's and not ass burgers.	en	[]	[]	[]	85	73	2138	[]	[]	https://twitter.com/paulg/status/1401958051154903044	False		0								[]				
1401924269295259649	1401806727918542851	2021-06-07 23:29:26 CST	2021-06-07	23:29:26	+0800	183749519	paulg	Paul Graham		@roddreher The funny thing is, it's even truer than she realizes.	en	[]	[]	[]	6	3	236	[]	[]	https://twitter.com/paulg/status/1401924269295259649	False		0								[{'screen_name': 'roddreher', 'name': 'Rod Dreher', 'id': '257145200'}]				
1401923226901622796	1401919637340753924	2021-06-07 23:25:18 CST	2021-06-07	23:25:18	+0800	183749519	paulg	Paul Graham		@rickasaurus I'm wearing them now.	en	[]	[]	[]	1	0	4	[]	[]	https://twitter.com/paulg/status/1401923226901622796	False		0								[{'screen_name': 'rickasaurus', 'name': 'Richard Minerich', 'id': '16377511'}]				
1401913495545954312	1401912821458386946	2021-06-07 22:46:38 CST	2021-06-07	22:46:38	+0800	183749519	paulg	Paul Graham		@lisperati I would not be at all surprised if hedge funds do this. It would be such a short period of exposure.	en	[]	[]	[]	2	0	22	[]	[]	https://twitter.com/paulg/status/1401913495545954312	False		0								[{'screen_name': 'lisperati', 'name': 'Conrad Barski', 'id': '35367022'}]				
1401912796267307011	1401912796267307011	2021-06-07 22:43:51 CST	2021-06-07	22:43:51	+0800	183749519	paulg	Paul Graham		When independent-minded people agree with you, don't assume that they're on your team and will always agree with you. Unless you're independent-minded enough yourself to understand this, if you praise them now, you'll be complaining later about how they've disappointed you.	en	[]	[]	[]	45	204	1595	[]	[]	https://twitter.com/paulg/status/1401912796267307011	False		0								[]				
1401904466669023239	1401901865152004099	2021-06-07 22:10:45 CST	2021-06-07	22:10:45	+0800	183749519	paulg	Paul Graham		@McCormickProf @PamelaParesky I wanted to like this, but the fact is you're always telling little kids what to believe. Every time you tell them the definition of a word, for example.	en	[]	[]	[]	3	0	11	[]	[]	https://twitter.com/paulg/status/1401904466669023239	False		0								[{'screen_name': 'McCormickProf', 'name': 'Robert P. George', 'id': '1969097227'}, {'screen_name': 'PamelaParesky', 'name': 'Pamela Paresky (Habits of a Free Mind)', 'id': '249951632'}]				
1401902142156324864	1401902142156324864	2021-06-07 22:01:31 CST	2021-06-07	22:01:31	+0800	183749519	paulg	Paul Graham		Before remote work became popular, governments didn't have much evidence of how much their bad immigration policy was costing them. Now they'll have a lot more.	en	[]	[]	[]	37	137	1140	[]	[]	https://twitter.com/paulg/status/1401902142156324864	False	https://twitter.com/immad/status/1401620834624577536	0								[]				
1401885952792989697	1401879675736100865	2021-06-07 20:57:11 CST	2021-06-07	20:57:11	+0800	183749519	paulg	Paul Graham		@iansephton a:b::x:y statements don't require a to be similar to x or y, but rather that the relationship between a and b be similar to the relationship between x and y.	en	[]	[]	[]	2	1	21	[]	[]	https://twitter.com/paulg/status/1401885952792989697	False		0								[{'screen_name': 'iansephton', 'name': 'Ian Sephton', 'id': '27177144'}]				
1401880496120926210	1401879675736100865	2021-06-07 20:35:30 CST	2021-06-07	20:35:30	+0800	183749519	paulg	Paul Graham		@StevenPWalsh That's true, and incidentally it's true of anything with real tests. Math problems also don't care about you.	en	[]	[]	[]	3	0	61	[]	[]	https://twitter.com/paulg/status/1401880496120926210	False		0								[{'screen_name': 'StevenPWalsh', 'name': 'Mr Reply Guy', 'id': '19478554'}]				
1401879675736100865	1401879675736100865	2021-06-07 20:32:15 CST	2021-06-07	20:32:15	+0800	183749519	paulg	Paul Graham		Getting good grades is to doing great work as peacetime soldiering is to wartime soldiering. You win at the former by obedience and at the latter by initiative and independent-mindedness.	en	[]	[]	[]	55	245	1661	[]	[]	https://twitter.com/paulg/status/1401879675736100865	False		0								[]				
1401860370650865664	1397869883585708034	2021-06-07 19:15:32 CST	2021-06-07	19:15:32	+0800	183749519	paulg	Paul Graham		@NateSilver538 Scott Gottlieb has the same heuristic:  https://t.co/j4JkrVv7Wx	en	[]	['https://twitter.com/ScottGottliebMD/status/1401857651261284352']	[]	1	0	12	[]	[]	https://twitter.com/paulg/status/1401860370650865664	False	https://twitter.com/ScottGottliebMD/status/1401857651261284352	0								[{'screen_name': 'NateSilver538', 'name': 'Nate Silver', 'id': '16017475'}]				
1401854968605335554	1401851188358926338	2021-06-07 18:54:04 CST	2021-06-07	18:54:04	+0800	183749519	paulg	Paul Graham		@WowHauser Wycliffe Stutchbury. What a name. If you called a character in a novel that, people would say it was unrealistic.	en	[]	[]	[]	1	0	21	[]	[]	https://twitter.com/paulg/status/1401854968605335554	False		0								[{'screen_name': 'WowHauser', 'name': 'WowHaus', 'id': '300339564'}]				
1401653745532952576	1401460854713991169	2021-06-07 05:34:29 CST	2021-06-07	05:34:29	+0800	183749519	paulg	Paul Graham		@snipeyhead I tweeted a link to that article myself earlier today, but it's about immigration problems, not SF's problems.	en	[]	[]	[]	2	1	8	[]	[]	https://twitter.com/paulg/status/1401653745532952576	False		0								[{'screen_name': 'snipeyhead', 'name': 'snipe, vaxxed poo doula ⭑⭒⭒⭒⭒', 'id': '14246782'}]				
1401642921464586241	1401641254790832136	2021-06-07 04:51:28 CST	2021-06-07	04:51:28	+0800	183749519	paulg	Paul Graham		@AndreTI That was one of the counterexamples I gave him, along with police.	en	[]	[]	[]	1	1	39	[]	[]	https://twitter.com/paulg/status/1401642921464586241	False		0								[{'screen_name': 'AndreTI', 'name': 'Andre Infante', 'id': '19191383'}]				
1401641254790832136	1401641254790832136	2021-06-07 04:44:51 CST	2021-06-07	04:44:51	+0800	183749519	paulg	Paul Graham		Something I taught my 12 yo: There may be some kinds of work where it's an advantage to be cynical and pessimistic, but in the great majority it's an advantage to be idealistic and optimistic, even if that means risking looking like a fool sometimes.	en	[]	[]	[]	64	358	3240	[]	[]	https://twitter.com/paulg/status/1401641254790832136	False		0								[]				
1401639772427370496	1401611195073716225	2021-06-07 04:38:57 CST	2021-06-07	04:38:57	+0800	183749519	paulg	Paul Graham		"@CathyReisenwitz ""Exceptional performance implies immigration. A country with only a few percent of the world's population will be exceptional in some field only if there are a lot of immigrants working in it.""   https://t.co/px0bA0Ou9x"	en	[]	['http://paulgraham.com/95.html']	[]	0	0	5	[]	[]	https://twitter.com/paulg/status/1401639772427370496	False		0								[{'screen_name': 'CathyReisenwitz', 'name': 'Cathy Reisenwitz', 'id': '181720256'}]				
1401638331474186242	1401460854713991169	2021-06-07 04:33:14 CST	2021-06-07	04:33:14	+0800	183749519	paulg	Paul Graham		@martridala When my parents moved to the US from England they were worried about bears.	en	[]	[]	[]	3	1	91	[]	[]	https://twitter.com/paulg/status/1401638331474186242	False		0								[{'screen_name': 'martridala', 'name': 'Märt Ridala', 'id': '16011555'}]				
1401637864731983879	1401635889634328576	2021-06-07 04:31:22 CST	2021-06-07	04:31:22	+0800	183749519	paulg	Paul Graham		@sprout94 Try to make something that specific people you know want to use.	en	[]	[]	[]	1	0	4	[]	[]	https://twitter.com/paulg/status/1401637864731983879	False		0								[{'screen_name': 'sprout94', 'name': 'Azaan Maqbool', 'id': '1390656167018471430'}]				
1401617260628819970	1401611195073716225	2021-06-07 03:09:30 CST	2021-06-07	03:09:30	+0800	183749519	paulg	Paul Graham		@CathyReisenwitz That's why in 2009 I proposed what has now become known as the Startup Visa:  https://t.co/zJbpIVQnnt	en	[]	['http://paulgraham.com/foundervisa.html']	[]	1	0	20	[]	[]	https://twitter.com/paulg/status/1401617260628819970	False		0								[{'screen_name': 'CathyReisenwitz', 'name': 'Cathy Reisenwitz', 'id': '181720256'}]				
1401612588199391243	1401611195073716225	2021-06-07 02:50:56 CST	2021-06-07	02:50:56	+0800	183749519	paulg	Paul Graham		@CathyReisenwitz If you want to learn more about it, I recommend reading this essay I wrote in 2011:  https://t.co/p7rpgGWsB4	en	[]	['http://paulgraham.com/hubs.html']	[]	8	2	105	[]	[]	https://twitter.com/paulg/status/1401612588199391243	False		0								[{'screen_name': 'CathyReisenwitz', 'name': 'Cathy Reisenwitz', 'id': '181720256'}]				
1401610960599662597	1401460854713991169	2021-06-07 02:44:28 CST	2021-06-07	02:44:28	+0800	183749519	paulg	Paul Graham		@fredwilson E.g. would American movies be better if Hollywood were broken up and distributed between 10 different US towns? Maybe, but quite possibly not.	en	[]	[]	[]	20	1	75	[]	[]	https://twitter.com/paulg/status/1401610960599662597	False		0								[{'screen_name': 'fredwilson', 'name': 'Fred Wilson', 'id': '1000591'}]				
1401609427497668611	1401460854713991169	2021-06-07 02:38:22 CST	2021-06-07	02:38:22	+0800	183749519	paulg	Paul Graham		@fredwilson Possibly, but not necessarily. Founders definitely benefit from the existence of startup hubs. So the question is whether n startup hubs with average benefit b are net better for startups as a whole than m &lt; n hubs with average benefit c &gt; b.	en	[]	[]	[]	15	4	120	[]	[]	https://twitter.com/paulg/status/1401609427497668611	False		0								[{'screen_name': 'fredwilson', 'name': 'Fred Wilson', 'id': '1000591'}]				
1401607061281062919	1401460854713991169	2021-06-07 02:28:58 CST	2021-06-07	02:28:58	+0800	183749519	paulg	Paul Graham		@ianivhojman @justinspratt Live well by doing things right.	en	[]	[]	[]	2	2	32	[]	[]	https://twitter.com/paulg/status/1401607061281062919	False		0								[{'screen_name': 'ianivhojman', 'name': 'Ianiv Hojman', 'id': '372899673'}, {'screen_name': 'justinspratt', 'name': 'Justin', 'id': '7758542'}]				
1401601927117422599	1401555379289571328	2021-06-07 02:08:34 CST	2021-06-07	02:08:34	+0800	183749519	paulg	Paul Graham		@r2r In my experience their range isn't limited to the middle, but extends to just short of the point where people have inherited wealth they'd have to give away to conform to their principles.	en	[]	[]	[]	2	1	114	[]	[]	https://twitter.com/paulg/status/1401601927117422599	False		0								[{'screen_name': 'r2r', 'name': 'Artur Adib', 'id': '125061482'}]				
1401543144596979715	1401460854713991169	2021-06-06 22:14:59 CST	2021-06-06	22:14:59	+0800	183749519	paulg	Paul Graham		@justinspratt I love Amsterdam. If I had to live in a city, that would be one of my first choices.	en	[]	[]	[]	7	4	153	[]	[]	https://twitter.com/paulg/status/1401543144596979715	False		0								[{'screen_name': 'justinspratt', 'name': 'Justin', 'id': '7758542'}]				
1401542548242456576	1401460854713991169	2021-06-06 22:12:37 CST	2021-06-06	22:12:37	+0800	183749519	paulg	Paul Graham		I know founders don't feel the same need to move to the US that they used to. The question is how much of this is due to the change in their opinion of the Bay Area specifically, rather than e.g. greater optimism about remote work, or decreased interest in the US overall.	en	[]	[]	[]	100	24	596	[]	[]	https://twitter.com/paulg/status/1401542548242456576	False		0								[]				
1401523819156840454	1401490446006767622	2021-06-06 20:58:12 CST	2021-06-06	20:58:12	+0800	183749519	paulg	Paul Graham		@WoganMay I know *that*. The question is what percentage of the change in their opinion is due to the change in their opinion of the Bay Area specifically.	en	[]	[]	[]	13	0	27	[]	[]	https://twitter.com/paulg/status/1401523819156840454	False		0								[{'screen_name': 'WoganMay', 'name': 'Wogan', 'id': '334784016'}]				
1401505733582196736	1401505733582196736	2021-06-06 19:46:20 CST	2021-06-06	19:46:20	+0800	183749519	paulg	Paul Graham		"Yesterday 9 yo finished dictating a 50 page story. I thought he'd take a day off, but this morning I heard a door open and a voice behind me: ""I want to write another story."""	en	[]	[]	[]	33	14	1040	[]	[]	https://twitter.com/paulg/status/1401505733582196736	False		0								[]				
1401497636537053186	1401249571821350912	2021-06-06 19:14:09 CST	2021-06-06	19:14:09	+0800	183749519	paulg	Paul Graham		"@sonyasupposedly One way to manufacture luck is to be a good person. If you're good, people will do good things for you ""behind your back,"" and since the causes are hidden, those will read to you as good luck. (For similar reasons, bad people will tend to think of themselves as unlucky.)"	en	[]	[]	[]	34	281	1738	[]	[]	https://twitter.com/paulg/status/1401497636537053186	False		0								[{'screen_name': 'sonyasupposedly', 'name': '🎀 sonya allegedly 🤖', 'id': '1247464470'}]				
1401466332323979264	1401465821063483392	2021-06-06 17:09:46 CST	2021-06-06	17:09:46	+0800	183749519	paulg	Paul Graham		(I don't mind when people call me a VC, but it's definitely a signal that they're not people from the startup world.)	en	[]	[]	[]	12	11	316	[]	[]	https://twitter.com/paulg/status/1401466332323979264	False		0								[]				
1401465821063483392	1401465821063483392	2021-06-06 17:07:44 CST	2021-06-06	17:07:44	+0800	183749519	paulg	Paul Graham		I'm not a particularly good investor at the series A stage. I'm too optimistic. Few grasp how different seed investing is from VC. It requires a different type of person.	en	[]	[]	[]	46	111	1577	[]	[]	https://twitter.com/paulg/status/1401465821063483392	False		0								[]				
1401460854713991169	1401460854713991169	2021-06-06 16:48:00 CST	2021-06-06	16:48:00	+0800	183749519	paulg	Paul Graham		A potential danger to America I didn't consider till now. The Bay Area seems to be less attractive to founders. What if this makes America as a country less attractive to immigrant founders? What if instead of going to another US city, they don't go to the US at all?	en	[]	[]	[]	679	333	4218	[]	[]	https://twitter.com/paulg/status/1401460854713991169	False		0								[]				
1401454662893592576	1401424980185780226	2021-06-06 16:23:24 CST	2021-06-06	16:23:24	+0800	183749519	paulg	Paul Graham		@bscholl Yeah, me too. When I fly alone I always get window seats, but when I fly with my kids I always have to let them have them.	en	[]	[]	[]	2	1	45	[]	[]	https://twitter.com/paulg/status/1401454662893592576	False		0								[{'screen_name': 'bscholl', 'name': 'Blake Scholl 🛫', 'id': '2435'}]				
1401453169155227649	1401453169155227649	2021-06-06 16:17:27 CST	2021-06-06	16:17:27	+0800	183749519	paulg	Paul Graham		"""It’s not like they came up with the idea. It’s an American idea that we failed to act on.""  Well, sort of.   https://t.co/YDyeFDo1sh"	en	[]	['https://www.forbes.com/sites/amyfeldman/2021/06/03/why-the-us-is-losing-immigrant-entrepreneurs-to-other-nations/']	[]	17	36	217	[]	[]	https://twitter.com/paulg/status/1401453169155227649	False		0								[]				
1401246449678094338	1400961893272072194	2021-06-06 02:36:02 CST	2021-06-06	02:36:02	+0800	183749519	paulg	Paul Graham		@ashwindoke @BostWiki There are some tips here:  https://t.co/Bu41gy8Fmx  It's not hard for me to find time. I retired from YC in 2014 and writing is the main thing I'm working on now.	en	[]	['http://paulgraham.com/useful.html']	[]	2	1	26	[]	[]	https://twitter.com/paulg/status/1401246449678094338	False		0								[{'screen_name': 'ashwindoke', 'name': 'Ashwin Doke', 'id': '32913296'}, {'screen_name': 'BostWiki', 'name': 'Alastair Bostwick', 'id': '2452513406'}]				
1401238608217055233	1401226918318444558	2021-06-06 02:04:52 CST	2021-06-06	02:04:52	+0800	183749519	paulg	Paul Graham		@ebruenig There are a lot of things we can't do anything about that I would nevertheless really like to know the truth about. All of math and science to start with.	en	[]	[]	[]	17	6	294	[]	[]	https://twitter.com/paulg/status/1401238608217055233	False		0								[{'screen_name': 'ebruenig', 'name': 'elizabeth bruenig', 'id': '1471542956'}]				
1401211089778581509	1400961893272072194	2021-06-06 00:15:31 CST	2021-06-06	00:15:31	+0800	183749519	paulg	Paul Graham		@BostWiki I had to ban myself from writing essays while I was working on Bel, because otherwise I'd never have finished it. After I finished it in October 2019 I could write again.	en	[]	[]	[]	2	0	41	[]	[]	https://twitter.com/paulg/status/1401211089778581509	False		0								[{'screen_name': 'BostWiki', 'name': 'Alastair Bostwick', 'id': '2452513406'}]				
1400927362917842952	1400927362917842952	2021-06-05 05:28:05 CST	2021-06-05	05:28:05	+0800	183749519	paulg	Paul Graham		Rewatched Chitty Chitty Bang Bang for the first time since I watched it as a 4 yo in the theater in 1969. I still remembered the Child Catcher and his wagon.  https://t.co/xAY20CN8Uo	en	[]	[]	['https://pbs.twimg.com/media/E3EW7wFXwAILWHf.png']	39	19	362	[]	[]	https://twitter.com/paulg/status/1400927362917842952	False		1	https://pbs.twimg.com/media/E3EW7wFXwAILWHf.png							[]				
1400919638821666816	1400902443563552773	2021-06-05 04:57:24 CST	2021-06-05	04:57:24	+0800	183749519	paulg	Paul Graham		@Suhail Work on your startup.	en	[]	[]	[]	31	50	2080	[]	[]	https://twitter.com/paulg/status/1400919638821666816	False		0								[{'screen_name': 'Suhail', 'name': 'Suhail', 'id': '793023'}]				
1400846847191703556	1400832990515630081	2021-06-05 00:08:09 CST	2021-06-05	00:08:09	+0800	183749519	paulg	Paul Graham		@bariweiss Imagine how fast Yale would have disclaimed this event if she'd said this about any other race. They'd need a time machine to move as fast as they'd want to.	en	[]	[]	[]	50	150	2696	[]	[]	https://twitter.com/paulg/status/1400846847191703556	False		0								[{'screen_name': 'bariweiss', 'name': 'Bari Weiss', 'id': '289548939'}]				
1400845186427654148	1400837245666463747	2021-06-05 00:01:33 CST	2021-06-05	00:01:33	+0800	183749519	paulg	Paul Graham		@Rainmaker1973 Capabilities my ass. The flamethrower was built because he wanted to have a flamethrower.	en	[]	[]	[]	16	4	356	[]	[]	https://twitter.com/paulg/status/1400845186427654148	False		0								[{'screen_name': 'Rainmaker1973', 'name': 'Massimo', 'id': '177101260'}]				
1400844804876013576	1400839745761013764	2021-06-05 00:00:02 CST	2021-06-05	00:00:02	+0800	183749519	paulg	Paul Graham		@synopsi What would have been the biggest obstacles if you'd tried to build the company in the EU?	en	[]	[]	[]	22	1	48	[]	[]	https://twitter.com/paulg/status/1400844804876013576	False		0								[{'screen_name': 'synopsi', 'name': 'Rasty Turek', 'id': '14710416'}]				
1400825047594459139	1400777576965185539	2021-06-04 22:41:32 CST	2021-06-04	22:41:32	+0800	183749519	paulg	Paul Graham		@capbartsch @LefterisJP What? That's crazy. Why not?	en	[]	[]	[]	2	0	3	[]	[]	https://twitter.com/paulg/status/1400825047594459139	False		0								[{'screen_name': 'capbartsch', 'name': 'Christian Bartsch', 'id': '165778987'}, {'screen_name': 'LefterisJP', 'name': 'Lefteris Karapetsas | Hiring for @rotkiapp', 'id': '43949721'}]				
1400822982956797955	1400721145951928320	2021-06-04 22:33:19 CST	2021-06-04	22:33:19	+0800	183749519	paulg	Paul Graham		@sprout94 You might like the Harry Potter books if you haven't read them.	en	[]	[]	[]	1	0	5	[]	[]	https://twitter.com/paulg/status/1400822982956797955	False		0								[{'screen_name': 'sprout94', 'name': 'Azaan Maqbool', 'id': '1390656167018471430'}]				
1400791996130856962	1400777576965185539	2021-06-04 20:30:11 CST	2021-06-04	20:30:11	+0800	183749519	paulg	Paul Graham		@sbmcnamara Wow, really?	en	[]	[]	[]	4	1	10	[]	[]	https://twitter.com/paulg/status/1400791996130856962	False		0								[{'screen_name': 'sbmcnamara', 'name': 'sbmcnamara', 'id': '13578722'}]				
